{
  "instrument_type": "qualification-stance",
  "decision": "TEST-FIXTURE: ALPHA-TEST protocol would not qualify under Doctrine liquidity standards at horizon.",
  "thesis": "Fixture thesis text for BUILD-02 acceptance testing only.",
  "evidence_chain": [
    {
      "source_url": "https://example.test/evidence",
      "retrieved_at": "2026-08-17T00:00:00Z",
      "content_sha256": "aaaaaaaaaaaaaaaaaaaaaaaaaaaaaaaaaaaaaaaaaaaaaaaaaaaaaaaaaaaaaaaa"
    }
  ],
  "risk_statement": "Fixture risk statement.",
  "horizon": "2026-09-01T00:00:00Z",
  "resolution_criteria": [
    {
      "criterion_id": "c1",
      "statement": "pool depth below floor",
      "comparator": "<",
      "threshold": 100000,
      "evaluation_procedure": "read registry source X"
    }
  ],
  "resolution_sources": [
    {
      "criterion_id": "c1",
      "primary_source": "example-registry",
      "registry_class": "direct-onchain"
    }
  ],
  "conflicts_disclosures": [],
  "doctrine_version": "0.1.1",
  "schema_version": "1"
}